Tweet Text,Sentiment Label
michelle obama s becoming set to become best selling memoir in history
becoming by michelle obama
take care of you because you are the best asset you can invest in at this time michelle obama inspire learn
hillary way to win when one can t win by laws that have served our country well for years just change the rules fix the election and attempt a coup these crooks must be charged amp some sent to prison start with clinton obama amp michelle then move down the line
michelle obama becoming
presidential affairs 2008 2014
5 of 5 stars to becoming by michelle obama
wow she really stepped in it didn t she
remember when michelle obama was on icarly those used to be the days
michelle obama is said to have intervened in this lawsuit in favour of the ultimate perpetrator of this fraudelent crime i e jussie smollett
michelle obama is first rate
did anyone ever observed that you look like michelle obama
6 the christopher s disproportionate number of felons in america are poor and latino black that became the new n word
obama is great michelle is great
hey how are tu yaar barack michelle vaddi slim trim shtylish obama
in a statement cohen said the organization will emerge stronger after an audit of its practices by tina tchen a chicago based attorney and former chief of staff for former first lady michelle obama
wow here s something i won t be reading maybe it ll free up time for michelle obama s book or an oprah pick not
barack obama michelle obama hillary clinton bill clinton kathy griffin
becoming by michelle obama so much that i often go back and skim through annotations
is michelle obama around
oooh what s that i see why it s the murmur of bees riding high in the amazon usa audiobook charts hot on the heels of michelle obama can this mexican gem overtake the former first lady
michelle obama and oprah are both products of big government and black p via
oh ho ap ka leader purchi hath ma puker k michelle obama ko mr obama bol de tu local chawal mari chinese delegates k samne our friendship deeper then ocean sweater then honey bolnay k liay bhai se dictation le tu local chawal waji khan ki slip of tongue international
traffic mrs laura bush president george bush jnr president bill clinton mrs hillary clinton president barack obama mrs michelle obama mrs melania trump and president george bush snr
sorry can t come im star gazing in kazakhstan with michelle obama should be fantastic
you have to be an extremist to believe that you re gonna be the president of the united states and your name is barack hussein obama and he s using extreme methods but his application is very smooth michelle
i m pretty sure the donegal gorse fires were the work of the swamp dragon michelle obama on her global fire setting crusade notredame was first watch out for fires up north on thetwelfth of july i ve information the obamas may be in town that day ee19
from an outsider the best pres you could get is michelle obama but i don t think she wants the job
you can t make decisions based on fear and the possibility of what might happen michelle obama
little girl to michelle obama you re too young for 51 via
hi melissa are you on i swap book ideas over there if you are can you please friend me and we can swap ideas the value of goodreads is that i can see what my bookworm friends are reading for fun i m reading becoming by michelle obama
michelle obama s complete style transformation her smiles are so genuine smartnews
ellen and michelle obama make a deadly comedy duo cures all depression
how absorbing here faustine s photography collides beautifully with s self fashioning black women leaders seated regal re amy sherald s michelle obama and draped in luxurious fabric of african american and africa diasporic traditions
67 done with becoming by michelle obama
thinking about michelle obama saying girl you ve done it again
just make me look classy like michelle obama
after 4 months of stalling i finished michelle obama s book in two days super proud of myself
still can t believe i saw michelle obama
your story is what you have what you will always have it is something to own michelle obama in becoming
crazy cat lady has to undertake a dangerous mission to save the life of michelle obama
she s michelle obama confirmed
hi michelle obama my friend caroline was hospitalized w intense trauma to the brain coachella2019 amp we r trying to help her and her family any exposure helps god bless please message me
right i hope they grow up and be like michelle obama who smokes weed and gives the finger to the paps an inspiration to many
remember all the right wing people who kept claiming that michelle obama was a trans woman
found this pic of aunt ester amp obama pretty funny ha ha ha ha michelle would get her about her man
on the global stage you should really should tell us what you did with the 70 million michelle obama have you for girls education it wasn t meant for your daughters education or yours was it on the global stage
the noise doesn t go away but successful people figure out how to live with it and push onward with their goals michelle obama
women should wear whatever makes them feel good about themselves michelle obama
michelle obama s becoming set to become best selling memoir in history
in iowa liz warren has everything memorized and talks at people not to them harvard law profs are introverts who write articles nobody reads talks to people it s a subtle quality he has it so does joe and michelle obama
i just love telling mfs that i went to the same high school as michelle obama i almost feel as amazing as her
dude at work tried to blame michelle obama for an act put into effect by the bush administration the amount of misinformation that needs to be corrected is so concerning good thing he s in charge of me i m in great hands
mckraken quill adams livewithlove urcrap2 why does melania deserve our respect she came here illegally in the 90 s lied about attending a university plagiarized michelle obama at least 4 times taking credit for the bebest brochure she copied from the obama administration michelle was sought after by all msm
hi michelle obama so you want to be come the president after that who will run the country hillary rodham clinton this one right bernie sandersw will get big job no power bho will play race card for got of huma later will post on her now lunch time bye
one of the lessons that i grew up with was to always stay true to yourself and never let what somebody else says distract you from your goals michelle obama bbmastopsocial bts twt
i wish michelle obama would come to bakersfield or ellen
alright what i gotta do to see michelle obama on college signing day
allison potus get out of the way hahahaha he let them take the lead from day one while pelosi and hillary and michelle obama are yapping smack about trump on talk forums he s been getting things done
6 becoming by michelle obama
john podesta was in nz right before the nz massacre samantha powers was in sri lanka right before the easter bombing michelle obama was in paris during the notre dame cathedral fire so i have to ask which corrupt democrat recently visited versailles
i m predicting a brokered dem convention with michelle obama winnig the nomination
thesauce s latest project homecoming on netflix dropped last week and is a fan
someone buy me michelle obama s book pls
quill adams livewithlove urcrap2 maga demands respect for melania while trashing jackie o and michelle obama
trinity college professor tweets whiteness is terrorism refers to barack and michelle obama as white kneeg hartford courant
barack amp michelle obama went to buckingham palace amp spent the day with queen elizabeth they got a state visit with her amp she not only held a state dinner for them the couple also spent the night at the palace oh and they received the love of the british people
nobody influencer since a lot of you ve been asking me about the secret of pm shri narendra modi ji s healthy skin modi obama jee always asks me about the secret of my healthy glowing skin despite only 3 hours of sleep michelle jee always grills him iss baar poochha ya nahi
when they go low you go high michelle obama freshbreakfast
go high when they go low michelle obama wow wow i am learning a lot thank you freshbreakfast conflictresolutionwednesday
so as the story goes michele obama paid hillary clinton s tailor a visit to get a few new pant suits this being michelle s first occassion to use this tailor you could imagine her shock when the tailor enquired do you tuck right or left unsealtheindictments guillotine
friend from sd visiting with his wife espies sport award show is on and the wife says who s that where do i know her from i turn to see michelle obama presenting an award how how
becoming michelle obama the third eye t lobsang rampa the power of your subconscious mind joseph murphy
attention lqqk j smollett was let go because michelle obama appairantly she knows someone that works there amp is friends with her mom this explains the silence m obama s in the shadows caniving democrats their not very bright r they
channeling my inner michelle obama
first lady michelle obama carpool karaoke
the fashion diplomat what michelle obama wore on her book tour finance business investissement via
this is how michelle obama gets those toned arms
quill adams livewithlove mckraken urcrap2 phony fake photoshopped michelle obama has a harvard law degree unlike melania who lied about going to a college click open class and beauty
obama said i will always stand with islam michelle said all this for a damn flag fool me once shame on you fool me twice shame on me
michelle obama s becoming set to become best selling memoir in history
michelle obama she could be the only one to get us out of this mess i can see her looking down on putin oh ok sorry i want her other than that i haven t figured out yet
you re awake by the way yes hillary clinton and michelle obama are taking america to hell bringing the caliphate sharia law and beheadings for only one time power grab on planetary scale
quill adams livewithlove mckraken urcrap2 the obama know beyonce not as a public mega star but as a wife mother and daughter her performances are separate from the beyonce they see its not moochelle its michelle her daughters are not heathens you have hers mixed up with yours
becoming de michelle obama
agh i m helping out with college signing day with michelle obama adam rippon nia sioux pentatonix agghghghghghgh what a huge opportunity c im w h e e z i n g
michelle obama on the time she broke royal protocol with queen elizabeth and why she wouldn t take it back
john kerry cares about corrupt john kerry not to bright and pawn for gay blade obama and michael levon robinson aka michelle obama
traffic laura bush george bush jnr bill clinton hillary clinton michelle obama barack obama mrs trump and george bush snr
becoming by michelle obama the crown publishing group is a hint not a memoir the fight for one time only power grab
remember when michelle obama would just be in tv shows that was great
notre dame burns as michelle obama floats by via
u forgetting something for u and mrs michelle obama hahahahha daal keema is waiting for u hahahah
i can t believe we had our radical islamic terrorist as our president for the last 8 years when the truth comes out everybody will know about barry obama and big mike michelle lockhimup oh yeah you already did i wonder how he likes his new living quarters at gitmo kag
my response to michelle obama comment about america living with divorce via
on page 85 of 426 of becoming by michelle obama
when they go low we go high michelle obama
michelle obama s face is ugly as f ck why would anyone even barack wanna hit that
michelle obama s becoming set to become best selling memoir in history
watters on felons voting dems may get to impeachment michelle obama
tina tchen some want texts from michelle obama s ex top aide to the jussie smollett prosecutor investigated cnn
had a dream michelle obama was standing over me while i was sleeping
wait can i even be the type of partner the guy i want deserves i know yall understand me can i be michelle obama
i wonder how michelle obama is doing
thanking hon ble us president barack obama and hon ble michelle obama thanking your global humanity services thanking barack obama foundation moorthy kaliappan btch iitm 1980 amp paniit usa chief executive officer moorthy minerals inc ca 94587 91 9962380254 skype pushpalok
thanking hon ble us president barack obama thanking your great services to global humanity thanking hon ble president barack obama amp thanking michelle obama moorthy kaliappan btch iitm 1980 amp paniit usa chief executive officer moorthy minerals inc ca 94587 91 9962380254
nah bro michelle obama is where it s at she could get it
u on tucker awesome as usual but jussie smellit case is no mystery michelle obama made a phone call to her hatchet woman who called foxx and told her to drop charges smellit is a friend of obamas typical tarmac meeting hillary walked jussie walks rigged
we need to impeach obama can we take away his and michelle s book money
slip pics assfuck pain xx movies of trafiking of girls showing porn michelle obama naked porn julianne
tom obama sent hillary lots of emails on her insecure server and there is a plot to bring michelle obama to contest for president on the democratic platform in 2024
5 of 5 stars to becoming by michelle obama
obama haters attack from every angle they can they somehow had an issue with michelle trying to get kids to eat healthier wtf
females out here wanna be treated like michelle obama but carry themselves like the city girls then wonder why they can t find a decent man
my auntie thought she michelle obama w this phone
dnc theory step 1 get rid of bernie how run many wacko socialist to scare voters to water down bernie s base dnc theory step 2 answer joe biden potus amp michelle obama vp 2020 candidates their back
i know a guy he s married to michelle obama i don t know if he s available but he s the kind of guy you re talking about
taygeta podesta s in nz with their puppet pm ardern on russia hacks amp gun control then michelle obama was on a dinner cruise along the seine river in paris when the notre dame cathedral caught fire on monday night right next to nd and now this panicpanic
these same type of people are those that cheer on what said on first take the straw man argument about president obama being against gay rights was idiotic he wasn t michelle bauchman s husband who believed in gay conversion therapy
that twisted kind of comment is just unfathomable to me why would anyone attack michelle obama like that she was an excellent first lady empathetic smart funny hardworking and above reproach i love and admire her so much
this is a terrible idea michelle obama not a terrible idea all you had to do is beat up the president with policy for 4 years and put up some calm boring person landslide nope aaaahahhahah russia ahhahahahha muslim ban fine people on both sides ahhha
from a wrecked paul ryan to a innovative michelle obama don t knock on death s door ring the doorbell and run the trashed empousai
podesta was in christchurch nz during mosque shooting michelle obama was on a dinner cruise along the seine river in paris when the notre dame cathedral caught fire on monday night literally right behind it as it burned and now samantha in sri lanka how odd
jailene ramirez did more for our hungry children than michelle obama did send tweet
he s so full of michelle obama already screwed up school lunches that pissed me off since my kids didn t want to buy so i had to pack lunches now de blasio is doing the same dumb
michelle obama miraculously in france sipping champagne near notre dame before 850 year old church burst into flames
everything has meaning jfk jr president jfk funeral melania trump trump inauguration what was melania wearing what gift did she give michelle obama there are no coincidences thegreatawakening
michelle obama miraculously in france sipping champagne near notre dame before 850 year old church burst into flames
i think if i ever met michelle obama i would accidentally call her mom
books i tend to listen to non fiction audio books it feels as if you re listening to a podcast i especially love autobiographies read by the author michelle obama s book or amy poehler s for example it s as if they are talking to you direct
i took a free 2014 ladie s home journal magazine from the library today with michelle obama on it because i didn t want someone to take it home and defecate on it people are evil
just got to the part in michelle obama s book where she describes the overwhelming thirst she experienced when she first saw barack play basketball i can t wait to see the part in jenna s memoir when she describes the first time she saw me play tetris
i get disappointed every time i listen to forward and don t hear michelle obama s speech come in
michelle obama being president doesn t change who you are it reveals who you are has revealed himself to be cruel self absorbed greedy stupid petulant untrustworthy shallow immature bigoted unlikable conniving obnoxious reckless destructive vindictive amp ugly
i m at my grandma s amp i only catch my cousins wifi when i sit on the very corner of the bed amp i m so glad because now i might actually read all of michelle obama s book lmfao
susan albert supporter trump left obama at the bus stop in his first year trump did more in 1 year than obama did in 8 obama is not a man michelle has more junk in her trunk than obama bruce jenner is donating his balls to obama fox maga fightback
my capacity to be disgusted gets higher and higher as he gets lower and lower i don t think that s what michelle obama meant
watch did michelle obama break ftc law with 50 second beyonce video on youtube
michelle obama does and liz warren sounded close last night but other than that no
is michelle obama around wouldn t surprise me
my democratic party was the party of franklin roosevelt mlk jfk and barack amp michelle obama it s now the party of elijah cummings kamala harris aoc ilhan omar and liz warren you are a reactionary and need to catch up it is the party of the people and we shall overcome
he called me my lil michelle obama lol
the real mo fo obama should be in the electric chair with crooked hillary and michelle too michelle has more junk in her trunk than obama maga deepstatecoup obamalegacy impeach44 the mf
1 i don t consider michelle obama masculine 2 so what if she is it s just plain ignorant the obamas displayed a loving relationship throughout the 8 years of the presidency and beyond
president obama put millions and millions into the military and millions more for housing for vets michelle is a fantastic role model obama administration committed no crimes unlike the current one if you don t like her book don t read it
hood niggas really will have a bitch feeling great about herself you tell a hood nigga you re on your way to class amp he ll reply my lil michelle obama
just wanted you to know obama and michelle got to stay but she doesn t have room for you here s a secret she doesn t like you nobody does maybe if you give her a copy of your taxes and a full recorded confession
pj yeah becoming michelle obama hidden disclosure paradox i know it s a hint also she is very becoming well a lot of ppl think so so triple meaning for that book title
i think that pike is sincere too but there is a paternal distance too i think one of the things about him is that he helps you want to be your best self but honestly being around someone who is constantly inspiring seems exhausting its like being besties w michelle obama
i want michelle obama to run but not sure that s going to happen the candidates right now are good but idk
